{
  "dataset": "Waymo",
  "metric": "mAP",
  "contentionLevels": [0, 38, 45, 64, 67],
  "sloTargets": [100, 350, 500],
  "dsvt_voxel": {
    "100ms": {
      "0": 67.1,
      "38": 55.0,
      "45": 52.0,
      "64": 48.0,
      "67": 47.0
    },
    "350ms": {
      "0": 67.1,
      "38": 64.0,
      "45": 62.5,
      "64": 60.0,
      "67": 59.5
    },
    "500ms": {
      "0": 67.1,
      "38": 66.5,
      "45": 65.8,
      "64": 64.5,
      "67": 64.0
    }
  },
  "agile3d": {
    "100ms": {
      "0": 68.5,
      "38": 62.0,
      "45": 58.0,
      "64": 53.0,
      "67": 52.0
    },
    "350ms": {
      "0": 72.0,
      "38": 71.5,
      "45": 70.5,
      "64": 68.0,
      "67": 67.0
    },
    "500ms": {
      "0": 74.0,
      "38": 73.5,
      "45": 72.5,
      "64": 70.5,
      "67": 69.5
    }
  }
}
